_id,name,rarity,carry_capacity,buy,sell,description,icon_name,icon_color,account
2056,Ripened Mushroom,3,10,1000,100,A Unique Mushroom made more unique by maturing its aroma and flavor. (Account Item),icon_mushroom,2,1
2057,Great Shroom,3,10,5000,500,A rare mushroom that only grows from the roots of certain plants. (Account Item),icon_mushroom,7,1
2058,Abyssal Mushroom,2,10,1200,120,A flavorful mushroom that grows in the depths of the ancient forest. (Account Item),icon_mushroom,11,1
2059,Super Sprout,2,10,600,60,A special sprout that grows in the mountains. Considered a delicacy. (Account Item),icon_sprout,4,1
2060,Tropical Berry,4,20,500,50,A bright red strawberry from scorching climes. (Account Item),icon_seed,1,1
2061,Mountain Herbs,4,20,500,50,An herb found in the Arctic Ridge and prized for its nutritiousness. (Account Item),icon_herb,0,1
2062,Unique Fern,2,20,550,55,"Found only in the Jurassic Frontier. Bitter, but also sweet. (Account Item)",icon_herb,2,1
2063,Choice Fern,4,10,5500,550,"Perfectly shaped, exquisitely bitter. Even better than a Unique Fern. (Account Item)",icon_herb,2,1
2064,Goldenfish,3,10,5000,500,A rare fish made of solid gold. Sell it for a tidy sum. (Account Item),icon_fish,4,1
2065,Silverfish,5,10,15000,1500,A rare fish made of pure silver. Sell it for a tidy sum. (Account Item),icon_fish,0,1
2066,Brocadefish,3,10,5400,540,A beautiful fish with many vivid colors. Nobles keep them as pets. (Account Item),icon_fish,8,1
2067,King Brocadefish,5,10,16200,1620,The name given to large and particularly beautiful Brocadefish. (Account Item),icon_fish,1,1
2068,Premium Sashimi,5,10,1800,180,The ultimate fatty tuna sashimi. It melts on the tongue. (Account Item),icon_fish,0,1
2069,Royal Rhino,2,10,1700,170,A beetle with a jewel-like gleam that collectors pay dearly for. (Account Item),icon_bug,6,1
2070,Divine Rhino,4,10,10000,1000,A sublime prize from the Altaroth collectors adore. (Account Item),icon_bug,6,1
2071,Silver Cricket,2,10,2100,210,A cricket with silver wings. Chirps the soothing sounds of summer. (Account Item),icon_bug,0,1
2072,Gold Cricket,4,10,9800,980,A cricket with gold wings. Chirps the soothing sounds of summer. (Account Item),icon_bug,4,1
2073,Immortal Moth,2,10,1600,160,A pretty moth that seems to live forever. It is used in medicine. (Account Item),icon_bug,12,1
2074,Large Immortal Moth,4,10,12000,1200,A giant Immortal Moth. Said to be able to grant eternal life. (Account Item),icon_bug,12,1
2075,Auristone Piece,3,10,2000,200,"A piece of extremely pure Auristone. Very rare, and very valuable. (Account Item)",icon_ore,4,1
2076,Auristone Chunk,4,10,10000,1000,A precious clump of Auristone. Its shine is truly captivating. (Account Item),icon_ore,4,1
2077,Balmstone Piece,3,10,1800,180,A small piece of crimson ore. Rubbing it emits a scent of flowers. (Account Item),icon_ore,8,1
2078,Balmstone Chunk,4,10,9000,900,A faint crimson ore. Emits a flowery fragrance when rubbed. (Account Item),icon_ore,1,1
2079,Dragon Amber Piece,3,10,1800,180,"A fragment of amber from a dragon, hardened over time. (Account Item)",icon_ore,7,1
2080,Dragon Amber Chunk,4,10,14000,1400,A fist-sized chunk of Dragon Amber. It glints a reddish- gold. (Account Item),icon_ore,7,1
2081,Crystal Bone,2,10,600,60,A unique bone valued by both monster scholars and collectors. (Account Item),icon_bone,5,1
2082,Bloodstone,3,10,900,90,Is this crimson stone the relic of some ancient beast? (Account Item),icon_ore,1,1
2083,Deep Bloodstone,4,10,9000,900,A Bloodstone of an even deeper color. Its brightness is impressive. (Account Item),icon_ore,1,1
2084,Coal,3,10,1500,150,A combustible rock that emits a faint warmth. (Account Item),icon_ore,10,1
2085,Volatile Coal,4,10,12500,1250,A combustible rock so hot it may burst into flame at any second. (Account Item),icon_ore,1,1
2086,Fossilized Bone,2,10,600,60,A fossilized herbivore bone. Hunters pick these up as souvenirs. (Account Item),icon_bone,0,1
2087,Decayed Scale,5,99,2500,250,A dragon scale that long years have reduced to this sad husk. (Account Item),icon_scale,10,1
2088,White Liver,2,10,1000,100,"A white-colored liver, popular for its juicy texture. (Account Item)",icon_meat,0,1
2089,Slagtoth Oil,3,10,1000,100,Oil extracted from a Slagtoth's skin. Can be made into potions or salves. (Account Item),icon_liquid,2,1
2090,Secret Stash,3,10,1000,100,A pouch carried by a Melynx. Full of miscellaneous junk. (Account Item),icon_seed,2,1
2091,Round Acorn,3,10,300,30,A perfectly round acorn. It's a Felyne's beloved treasure. (Account Item),icon_seed,2,1
2092,Fine Stomach,2,10,4000,400,A pretty Altaroth stomach. Its contents are delicious. (Account Item),icon_sac,4,1
2093,Luminous Stomach,3,10,8000,800,A shiny Altaroth stomach. Sold as a choice cooking ingredient. (Account Item),icon_sac,7,1
2094,Monster Guts,3,10,1200,120,Monster innards galore. A prized delicacy. (Account Item),icon_carapace,4,1
2095,Piscine Liver,3,10,3000,300,An organ said to provide relief from many ailments. (Account Item),icon_carapace,4,1
2096,Popo Tongue,3,99,600,60,"Popo tongues are popular, healthy, and fun to eat. (Account Item)",icon_meat,1,1
2097,Apceros Liver,3,10,2000,200,An organ that may deliver hidden benefits if prepared a certain way. (Account Item),icon_carapace,4,1
2098,Ancient Berry,2,10,1200,120,"Larinoths love them, and may drop one if attacked while feeding. (Account Item)",icon_seed,13,1
2099,Water Lily Root,3,10,800,80,"Larinoths love them, and may drop one if attacked while drinking. (Account Item)",icon_herb,13,1
2100,Water Lily Tuber,4,10,8000,800,Enlarged root of the water lily. Used in medicine and cooking. (Account Item),icon_herb,13,1
2101,Moofah Fur,3,10,500,50,"The fur from a wild Moofah. People dig its rough, sword- hewn look. (Account Item)",icon_hide,4,1
2102,Beautiful Shell,2,10,0,40,A pale and pretty seashell. (Account Item),icon_scale,8,1
2103,Comet Rock,4,10,12500,1250,A glowing red rock. Used in ancient civilizations for making decorations. (Account Item),icon_ore,14,1
2104,Tall Mushroom,4,10,7000,700,Mushroom used as medicine. Not so good for eating. (Account Item),icon_mushroom,10,1
2105,Gargwa Egg,4,1,2000,200,"An egg laid by a Gargwa. Common in food, yet still very costly. (Account Item)",icon_egg,6,1
2106,Gold Gargwa Egg,5,1,5000,500,A rare Gargwa egg. Theories abound as to reasons for the golden shine. (Account Item),icon_egg,4,1
2107,Wyvern Egg,5,1,12000,1200,An egg that was stolen from a monster's nest. (Account Item),icon_egg,0,1
2108,Sootstone Ore,5,1,8000,800,Ore containing traces of sootstone. (Account Item),icon_ore,10,1
2109,Quartz Ore,5,1,25000,2500,A chunk of ore that contains bits of quartz. (Account Item),icon_ore,0,1
2110,Powderstone,5,1,30000,3000,A rock that explodes with even the slightest jolt. Careful! (Account Item),icon_ore,1,1
2111,Carnivore Egg,4,1,7000,700,A delicious egg stolen from the nest of a carnivorous monster. (Account Item),icon_egg,7,1
2112,Meteor Chunk,5,1,10000,1000,A rare and fragile specimen. Careful not to drop it! (Account Item),icon_ore,3,1
2113,Eternal Fossil,5,1,15000,1500,A large fossil found deep in the forest. What lies within is unknown. (Account Item),icon_ore,10,1
2114,Herbivore Egg,5,1,10000,1000,A tasty-looking egg stolen from a herbivore's nest. (Account Item),icon_egg,11,1
2115,Cannon Ammo,5,1,0,0,Special ammo for an anti-dragon cannon. The three round bundle is very heavy. (Supply Item),icon_ammo,10,0
2116,Guild Flag,3,1,0,0,A flag used to prove you've conquered a mountain summit. (Supply Item),icon_question_mark,4,0
2117,Gargwa Guano,2,10,250,25,Gargwa droppings. Can be dried and powdered for medicinal use. (Account Item),icon_dung,4,1
2118,Territorial Dung,3,10,5000,500,Monsters leave these lumps of dung to mark territory. (Account Item),icon_dung,7,1
2119,Territorial Dung+,5,10,25000,2500,A large lump of dung used to mark monster territory. (Account Item),icon_dung,7,1
2120,Drone Substance,3,10,4500,450,A pheromone sometimes released by Neopterons and Temnocerans. (Account Item),icon_liquid,4,1
2121,Queen Substance,5,10,22000,2200,A potent pheromone sometimes released by Neopterons and Temnocerans. (Account Item),icon_liquid,4,1
2122,Toad Tear,3,10,4000,400,Bitter tears wept by amphibians on certain occasions. (Account Item),icon_carapace,11,1
2123,Large Toad Tear,5,10,18000,1800,"Large, bitter tears wept by amphibians on certain occasions. (Account Item)",icon_carapace,11,1
2124,Carapaceon Brains,3,10,1500,150,"A rare delicacy, if you like the other type of noodle... (Account Item)",icon_carapace,7,1
2125,Carapaceon Brains+,3,10,5000,500,Grey matter that graces a true gourmand's platter. (Account Item),icon_carapace,7,1
2126,Crab Pearl,3,10,5000,500,"A jewel formed inside the body over many, many years. (Account Item)",icon_carapace,10,1
2127,Crab Pearl+,3,10,25000,2500,"A fine specimen that has been forming for a long, long time. (Account Item)",icon_carapace,10,1
2128,Wyvern Tear,3,10,5000,500,Bitter tears wept by wyverns on certain occasions. (Account Item),icon_carapace,3,1
2129,Large Wyvern Tear,5,10,25000,2500,"Large, bitter tears wept by wyverns on certain occasions. (Account Item)",icon_carapace,3,1
2130,Beast Tear,3,10,4000,400,Bitter tears wept by fanged beasts on certain occasions. (Account Item),icon_carapace,6,1
2131,Large Beast Tear,5,10,18000,1800,"Large, bitter tears wept by fanged beasts on special occasions. (Account Item)",icon_carapace,6,1
2132,Dragon Treasure,3,10,8000,800,A shiny rock that elder dragons like to collect. (Account Item),icon_carapace,5,1
2133,Old Dragon Treasure,5,10,40000,4000,A shiny rock that grew more brilliant in the care of an elder dragon. (Account Item),icon_carapace,5,1
2134,Frenzy Shard,4,10,4000,400,A disturbing crystal. The Guild demands these be turned in. (Account Item),icon_wyvern_crystal,5,1
2135,Frenzy Crystal,5,10,7000,700,An unsettling crystal. The Guild demands these be turned in. (Account Item),icon_wyvern_crystal,5,1
2136,Vile Frenzy Crystal,6,10,30000,3000,A sanity-robbing crystal. The Guild demands these be turned in. (Account Item),icon_wyvern_crystal,5,1
2137,Khezu Whelp,4,1,4000,400,A Khezu larva. Carrying it is enough to drain your Health. (Account Item),icon_carapace,10,1
2138,Khezu Coin,4,99,3000,300,A coin awarded for defeating a Khezu in the Arena.,icon_coin,0,0
2139,Najarala Coin,4,99,4000,400,A coin awarded for defeating a Najarala in the Arena.,icon_coin,4,0
2140,Rathalos Coin,4,99,5000,500,A coin awarded for defeating a Rathalos in the Arena.,icon_coin,1,0
2141,Kecha Coin,6,99,8000,800,A coin awarded for defeating a Kecha Wacha in the Arena.,icon_coin,7,0
2142,Plesioth Coin,6,99,9000,900,A coin awarded for defeating a Plesioth in the Arena.,icon_coin,3,0
2143,Brachydios Coin,6,99,10000,1000,A coin awarded for defeating a Brachydios in the Arena.,icon_coin,9,0
2144,Gypceros Coin,4,99,3000,300,A coin awarded for defeating a Gypceros in the Arena.,icon_coin,5,0
2145,Drome Coin,6,99,9000,900,A coin awarded for defeating a monster with a record in the Arena.,icon_coin,2,0
2146,Garuga Coin,8,99,15000,1500,A lovely coin awarded for defeating a Yian Garuga in the Arena.,icon_coin,5,0
2147,Uragaan Coin,8,99,17000,1700,A lovely coin awarded for defeating an Uragaan in the Arena.,icon_coin,11,0
2148,Seregios Coin,8,99,19000,1900,A lovely coin awarded for defeating a Seregios in the Arena.,icon_coin,4,0
2149,Tetsucabra Coin,8,99,6000,600,A lovely coin awarded for defeating a Tetsucabra in the Arena.,icon_coin,1,0
2150,Congalala Coin,8,99,7000,700,A lovely coin awarded for defeating a Congalala in the Arena.,icon_coin,8,0
2151,Horns Coin,8,99,0,0,G-rank Quest award given by the Pub Manager. Can be exchanged for various items.,icon_coin,5,0
2152,Humble Scrap,4,99,100,10,"A common, simple scrap of material. Collect a lot to make equipment for Palicoes.",icon_scraps,0,0
2153,Humble Scrap+,6,99,300,30,"A simple, but quality scrap of material. Collect a lot to make equipment for Palicoes.",icon_scraps,0,0
2154,Heavy Humble Scrap,8,99,1000,100,A simple but high-quality scrap of material. Collect a lot to make equipment for Palicoes.,icon_scraps,0,0
2155,Handsome Scrap,4,99,100,10,An impressive scrap of material. Collect a lot to make equipment for Palicoes.,icon_scraps,12,0
2156,Handsome Scrap+,6,99,300,30,An impressive and high-quality scrap of material. Collect a lot to make equipment for Palicoes.,icon_scraps,12,0
2157,Heavy Handsome Scrap,8,99,1000,100,A remarkably high-quality scrap of material. Collect a lot to make equipment for Palicoes.,icon_scraps,12,0
2158,Ore Scrap,4,99,100,10,"A small, irregular scrap of material. Collect a lot to make equipment for Palicoes.",icon_scraps,10,0
2159,Ore Scrap+,6,99,300,30,An irregular scrap of material. Collect a lot to make equipment for Palicoes.,icon_scraps,10,0
2160,Heavy Ore Scrap,8,99,1000,100,A high-quality scrap of material. Collect a lot to make equipment for Palicoes.,icon_scraps,10,0
2161,Insect Scrap,4,99,100,10,"A small, irregular scrap of material. Collect a lot to make equipment for Palicoes.",icon_scraps,4,0
2162,Insect Scrap+,6,99,300,30,An irregular scrap of material. Collect a lot to make equipment for Palicoes.,icon_scraps,4,0
2163,Heavy Insect Scrap,8,99,1000,100,A high-quality scrap of material. Collect a lot to make equipment for Palicoes.,icon_scraps,4,0
2164,Bone Scrap,4,99,100,10,"A small, irregular scrap of material. Collect a lot to make equipment for Palicoes.",icon_scraps,11,0
2165,Bone Scrap+,6,99,300,30,An irregular scrap of material. Collect a lot to make equipment for Palicoes.,icon_scraps,11,0
2166,Heavy Bone Scrap,8,99,1000,100,A high-quality scrap of material. Collect a lot to make equipment for Palicoes.,icon_scraps,11,0
2167,Wood Scrap,4,99,100,10,"A small, irregular scrap of material. Collect a lot to make equipment for Palicoes.",icon_scraps,7,0
2168,Wood Scrap+,6,99,300,30,An irregular scrap of material. Collect a lot to make equipment for Palicoes.,icon_scraps,7,0
2169,Heavy Wood Scrap,8,99,1000,100,A high-quality scrap of material. Collect a lot to make equipment for Palicoes.,icon_scraps,7,0
2170,Fur Scrap,4,99,100,10,"A small, irregular scrap of material. Collect a lot to make equipment for Palicoes.",icon_scraps,2,0
2171,Fur Scrap+,6,99,300,30,An irregular scrap of material. Collect a lot to make equipment for Palicoes.,icon_scraps,2,0
2172,Heavy Fur Scrap,8,99,1000,100,A high-quality scrap of material. Collect a lot to make equipment for Palicoes.,icon_scraps,2,0
2173,Rhenoplos Scrap,4,99,100,10,"A small, irregular scrap of material. Collect a lot to make equipment for Palicoes.",icon_scraps,10,0
2174,Rhenoplos Scrap+,6,99,300,30,An irregular scrap of material. Collect a lot to make equipment for Palicoes.,icon_scraps,10,0
2175,Heavy Rhenoplos Scrap,8,99,1000,100,A high-quality scrap of material. Collect a lot to make equipment for Palicoes.,icon_scraps,10,0
2176,Slagtoth Scrap+,6,99,300,30,An irregular scrap of material. Collect a lot to make equipment for Palicoes.,icon_scraps,2,0
2177,Bnahabra Scrap,4,99,100,10,"A small, irregular scrap of material. Collect a lot to make equipment for Palicoes.",icon_scraps,4,0
2178,Bnahabra Scrap+,6,99,300,30,An irregular scrap of material. Collect a lot to make equipment for Palicoes.,icon_scraps,4,0
2179,Heavy Bnahabra Scrap,8,99,1000,100,A high-quality scrap of material. Collect a lot to make equipment for Palicoes.,icon_scraps,4,0
2180,Great Jaggi Scrap,4,99,100,10,"A small, irregular scrap of material. Collect a lot to make equipment for Palicoes.",icon_scraps,5,0
2181,Great Jaggi Scrap+,6,99,300,30,An irregular scrap of material. Collect a lot to make equipment for Palicoes.,icon_scraps,5,0
2182,Hvy Great Jaggi Scrap,8,99,1000,100,A high-quality scrap of material. Collect a lot to make equipment for Palicoes.,icon_scraps,5,0
2183,Maccao Scrap,4,99,100,10,"A small, irregular scrap of material. Collect a lot to make equipment for Palicoes.",icon_scraps,13,0
2184,Maccao Scrap+,6,99,300,30,An irregular scrap of material. Collect a lot to make equipment for Palicoes.,icon_scraps,13,0
2185,Heavy Maccao Scrap,8,99,1000,100,A high-quality scrap of material. Collect a lot to make equipment for Palicoes.,icon_scraps,13,0
2186,Velociprey Scrap,4,99,100,10,"A small, irregular scrap of material. Collect a lot to make equipment for Palicoes.",icon_scraps,3,0
2187,Velociprey Scrap+,6,99,300,30,An irregular scrap of material. Collect a lot to make equipment for Palicoes.,icon_scraps,3,0
2188,Heavy Velociprey Scrap,8,99,1000,100,A high-quality scrap of material. Collect a lot to make equipment for Palicoes.,icon_scraps,3,0
2189,Giaprey Scrap+,6,99,300,30,An irregular scrap of material. Collect a lot to make equipment for Palicoes.,icon_scraps,0,0
2190,Heavy Giaprey Scrap,8,99,1000,100,A high-quality scrap of material. Collect a lot to make equipment for Palicoes.,icon_scraps,0,0
2191,Genprey Scrap,4,99,100,10,"A small, irregular scrap of material. Collect a lot to make equipment for Palicoes.",icon_scraps,2,0
2192,Genprey Scrap+,6,99,300,30,An irregular scrap of material. Collect a lot to make equipment for Palicoes.,icon_scraps,2,0
2193,Heavy Genprey Scrap,8,99,1000,100,A high-quality scrap of material. Collect a lot to make equipment for Palicoes.,icon_scraps,2,0
2194,Ioprey Scrap,4,99,100,10,"A small, irregular scrap of material. Collect a lot to make equipment for Palicoes.",icon_scraps,1,0
2195,Ioprey Scrap+,6,99,300,30,An irregular scrap of material. Collect a lot to make equipment for Palicoes.,icon_scraps,1,0
2196,Heavy Ioprey Scrap,8,99,1000,100,A high-quality scrap of material. Collect a lot to make equipment for Palicoes.,icon_scraps,1,0
2197,Arzuros Scrap,4,99,100,10,"A small, irregular scrap of material. Collect a lot to make equipment for Palicoes.",icon_scraps,3,0
2198,Arzuros Scrap+,6,99,300,30,An irregular scrap of material. Collect a lot to make equipment for Palicoes.,icon_scraps,3,0
2199,Heavy Arzuros Scrap,8,99,1000,100,A high-quality scrap of material. Collect a lot to make equipment for Palicoes.,icon_scraps,3,0
2200,Redhelm Scrap,6,99,500,50,"A small, irregular scrap of material. Collect a lot to make equipment for Palicoes.",icon_scraps,1,0
2201,Prime Redhelm Scrap,7,99,1000,100,An irregular scrap of material. Collect a lot to make equipment for Palicoes.,icon_scraps,1,0
2202,Elite Redhelm Scrap,8,99,2000,200,A high-quality scrap of material. Collect a lot to make equipment for Palicoes.,icon_scraps,1,0
2203,Perfect Redhelm Scrap,9,99,3000,300,An impressively high-quality scrap of material. Collect a lot to make equipment for Palicoes.,icon_scraps,1,0
2204,Lagombi Scrap,4,99,100,10,"A small, irregular scrap of material. Collect a lot to make equipment for Palicoes.",icon_scraps,0,0
2205,Lagombi Scrap+,6,99,300,30,An irregular scrap of material. Collect a lot to make equipment for Palicoes.,icon_scraps,0,0
2206,Heavy Lagombi Scrap,8,99,1000,100,A high-quality scrap of material. Collect a lot to make equipment for Palicoes.,icon_scraps,0,0
2207,Snowbaron Scrap,6,99,500,50,"A small, irregular scrap of material. Collect a lot to make equipment for Palicoes.",icon_scraps,5,0
2208,Prime Snowbaron Scrap,7,99,1000,100,An irregular scrap of material. Collect a lot to make equipment for Palicoes.,icon_scraps,5,0
2209,Elite Snowbaron Scrap,8,99,2000,200,A high-quality scrap of material. Collect a lot to make equipment for Palicoes.,icon_scraps,5,0
2210,Perfect Snowbaron Scrap,9,99,3000,300,An impressively high-quality scrap of material. Collect a lot to make equipment for Palicoes.,icon_scraps,5,0
2211,Volvidon Scrap,4,99,100,10,"A small, irregular scrap of material. Collect a lot to make equipment for Palicoes.",icon_scraps,1,0
2212,Volvidon Scrap+,6,99,300,30,An irregular scrap of material. Collect a lot to make equipment for Palicoes.,icon_scraps,1,0
2213,Heavy Volvidon Scrap,8,99,1000,100,A high-quality scrap of material. Collect a lot to make equipment for Palicoes.,icon_scraps,1,0
2214,Yian Kut-Ku Scrap,4,99,100,10,"A small, irregular scrap of material. Collect a lot to make equipment for Palicoes.",icon_scraps,8,0
2215,Yian Kut-Ku Scrap+,6,99,300,30,An irregular scrap of material. Collect a lot to make equipment for Palicoes.,icon_scraps,8,0
2216,Heavy Yian Kut-Ku Scrap,8,99,1000,100,A high-quality scrap of material. Collect a lot to make equipment for Palicoes.,icon_scraps,8,0
2217,Hyper Kut-Ku Scrap,6,99,500,50,"A small, irregular scrap of material. Collect a lot to make equipment for Palicoes.",icon_scraps,8,0
2218,Hyper Kut-Ku Scrap X,8,99,1500,150,A high-quality scrap of material. Collect a lot to make equipment for Palicoes.,icon_scraps,8,0
2219,Gypceros Scrap,4,99,100,10,"A small, irregular scrap of material. Collect a lot to make equipment for Palicoes.",icon_scraps,3,0
2220,Gypceros Scrap+,6,99,300,30,An irregular scrap of material. Collect a lot to make equipment for Palicoes.,icon_scraps,3,0
2221,Heavy Gypceros Scrap,8,99,1000,100,A high-quality scrap of material. Collect a lot to make equipment for Palicoes.,icon_scraps,3,0
2222,Hyper Gypceros Scrap,6,99,500,50,"A small, irregular scrap of material. Collect a lot to make equipment for Palicoes.",icon_scraps,3,0
2223,Hyper Gypceros Scrap X,8,99,1500,150,A high-quality scrap of material. Collect a lot to make equipment for Palicoes.,icon_scraps,3,0
2224,Malfestio Scrap,4,99,100,10,"A small, irregular scrap of material. Collect a lot to make equipment for Palicoes.",icon_scraps,15,0
2225,Malfestio Scrap+,6,99,300,30,An irregular scrap of material. Collect a lot to make equipment for Palicoes.,icon_scraps,15,0
2226,Heavy Malfestio Scrap,8,99,1000,100,A high-quality scrap of material. Collect a lot to make equipment for Palicoes.,icon_scraps,15,0
2227,Hyper Malfestio Scrap,6,99,500,50,"A small, irregular scrap of material. Collect a lot to make equipment for Palicoes.",icon_scraps,15,0
2228,Hyper Malfestio Scrap X,8,99,1500,150,A high-quality scrap of material. Collect a lot to make equipment for Palicoes.,icon_scraps,15,0
2229,Elite Nightcloak Scrap,8,99,2000,200,A high-quality scrap of material. Collect a lot to make equipment for Palicoes.,icon_scraps,15,0
2230,Perf. Nightcloak Scrap,9,99,3000,300,An impressively high-quality scrap of material. Collect a lot to make equipment for Palicoes.,icon_scraps,15,0
2231,Yian Garuga Scrap,4,99,100,10,"A small, irregular scrap of material. Collect a lot to make equipment for Palicoes.",icon_scraps,5,0
2232,Yian Garuga Scrap+,6,99,300,30,An irregular scrap of material. Collect a lot to make equipment for Palicoes.,icon_scraps,5,0
2233,Hvy Yian Garuga Scrap,8,99,1000,100,A high-quality scrap of material. Collect a lot to make equipment for Palicoes.,icon_scraps,5,0
2234,Hyper Garuga Scrap,6,99,500,50,"A small, irregular scrap of material. Collect a lot to make equipment for Palicoes.",icon_scraps,5,0
2235,Hyper Garuga Scrap X,8,99,1500,150,A high-quality scrap of material. Collect a lot to make equipment for Palicoes.,icon_scraps,5,0
2236,Deadeye Scrap,6,99,500,50,"A small, irregular scrap of material. Collect a lot to make equipment for Palicoes.",icon_scraps,16,0
2237,Prime Deadeye Scrap,7,99,1000,100,An irregular scrap of material. Collect a lot to make equipment for Palicoes.,icon_scraps,16,0
2238,Elite Deadeye Scrap,8,99,2000,200,A high-quality scrap of material. Collect a lot to make equipment for Palicoes.,icon_scraps,16,0
2239,Perfect Deadeye Scrap,9,99,3000,300,An impressively high-quality scrap of material. Collect a lot to make equipment for Palicoes.,icon_scraps,16,0
2240,Bulldrome Scrap,4,99,100,10,"A small, irregular scrap of material. Collect a lot to make equipment for Palicoes.",icon_scraps,7,0
2241,Bulldrome Scrap+,6,99,300,30,An irregular scrap of material. Collect a lot to make equipment for Palicoes.,icon_scraps,7,0
2242,Heavy Bulldrome Scrap,8,99,1000,100,A high-quality scrap of material. Collect a lot to make equipment for Palicoes.,icon_scraps,7,0
2243,Congalala Scrap+,6,99,300,30,An irregular scrap of material. Collect a lot to make equipment for Palicoes.,icon_scraps,8,0
2244,Heavy Congalala Scrap,8,99,1000,100,A high-quality scrap of material. Collect a lot to make equipment for Palicoes.,icon_scraps,8,0
2245,Hyper Congalala Scrap,8,99,1500,150,"A small, irregular scrap of material. Collect a lot to make equipment for Palicoes.",icon_scraps,8,0
2246,Blangonga Scrap,4,99,100,10,"A small, irregular scrap of material. Collect a lot to make equipment for Palicoes.",icon_scraps,0,0
2247,Blangonga Scrap+,6,99,300,30,An irregular scrap of material. Collect a lot to make equipment for Palicoes.,icon_scraps,0,0
2248,Heavy Blangonga Scrap,8,99,1000,100,A high-quality scrap of material. Collect a lot to make equipment for Palicoes.,icon_scraps,0,0
2249,Hyper Blangonga Scrap,6,99,500,50,"A small, irregular scrap of material. Collect a lot to make equipment for Palicoes.",icon_scraps,0,0
2250,Hypr Blangonga Scrap X,8,99,1500,150,A high-quality scrap of material. Collect a lot to make equipment for Palicoes.,icon_scraps,0,0
2251,Kecha Wacha Scrap+,6,99,300,30,An irregular scrap of material. Collect a lot to make equipment for Palicoes.,icon_scraps,7,0
2252,Hvy Kecha Wacha Scrap,8,99,1000,100,A high-quality scrap of material. Collect a lot to make equipment for Palicoes.,icon_scraps,7,0
2253,Hyper Kecha Scrap,6,99,500,50,"A small, irregular scrap of material. Collect a lot to make equipment for Palicoes.",icon_scraps,7,0
2254,Hyper Kecha Scrap X,8,99,1500,150,A high-quality scrap of material. Collect a lot to make equipment for Palicoes.,icon_scraps,7,0
2255,Cephalos Scrap,4,99,100,10,"A small, irregular scrap of material. Collect a lot to make equipment for Palicoes.",icon_scraps,6,0
2256,Cephalos Scrap+,6,99,300,30,An irregular scrap of material. Collect a lot to make equipment for Palicoes.,icon_scraps,6,0
2257,Heavy Cephalos Scrap,8,99,1000,100,A high-quality scrap of material. Collect a lot to make equipment for Palicoes.,icon_scraps,6,0
