_id,name,rarity,carry_capacity,buy,sell,description,icon_name,icon_color,account
1480,S.Magala Plate,5,99,65500,6550,A back scale claimed only by hunters who stand beneath the beast's wings and survive.,icon_scale,0,0
1481,S.Magala Phosgem,7,99,100000,10000,A pure jewel of light that ignites the skies and eradicates all darkness.,icon_monster_jewel,0,0
1482,S.Magala Mantle,9,99,150000,15000,A white scale believed lost. It can be used to create gear with superhuman power.,icon_mantle,0,0
1483,S.Magala Horn,4,99,16000,1600,A hardened sensory organ. The Frenzy's madness is still locked inside.,icon_fang,0,0
1484,S.Magala Horn+,6,99,30000,3000,A heroic arch whose hues have been changed; even now the Frenzy pollutes it.,icon_fang,0,0
1485,S.Magala Hardhorn,8,99,90000,9000,A Shagaru Magala horn. These are said to withstand the test of time and never decay.,icon_fang,0,0
1486,Pure Scale,4,99,7200,720,A scale of forbidden white whose complete lack of impurities is truly rare.,icon_scale,0,0
1487,Rajang Horn+,6,99,32000,3200,The majestic golden horn of a Rajang. Hunters yearn for the heroism it represents.,icon_fang,4,0
1488,Rajang Hardhorn,8,99,80000,8000,"A large, majestic golden horn. All who see it feel the over- whelming bravery of its owner.",icon_fang,4,0
1489,Rajang Fang+,6,99,27000,2700,This sharpened fang can cut through anything dumb enough to touch it.,icon_fang,4,0
1490,Rajang Hardfang,8,99,67500,6750,A Rajang fang that cuts through anything. A prey's life vanishes in an instant once caught.,icon_fang,4,0
1491,Rajang Blackfur,6,99,22800,2280,"Black Rajang fur. When crafted, the resulting fabric is desired even by royalty.",icon_hide,10,0
1492,Rajang Wildpelt,8,99,57000,5700,"A wild set of fur from a Rajang. When forged, the jet-black fur causes the wearer to rage.",icon_hide,10,0
1493,Rajang Claw+,6,99,30000,3000,A sharp Rajang claw. Difficult to carve and more difficult to craft.,icon_fang,10,0
1494,Rajang Hardclaw,8,99,75000,7500,A hard Rajang claw that's taken a multitude of lives in a manner best left unsaid.,icon_fang,10,0
1495,Rajang Tail,6,99,45000,4500,The glistening tail of a Rajang. The golden fur is beautiful and elegant.,icon_carapace,4,0
1496,Gold Rajang Pelt,6,99,96000,9600,Fur taken from a Rajang's body. The golden hair is treasured by tailors.,icon_hide,4,0
1497,Gold Rajang Pelt+,8,99,150000,15000,A golden pelt that shimmers with the same furious power as a Rajang.,icon_hide,4,0
1498,Rajang Ragehair,6,99,34200,3420,Hair that hardens when a Rajang becomes furious. Armorsmiths line up for it.,icon_hide,4,0
1499,Rajang Apoplexy,8,99,85500,8550,"A long mane which still bristles with rage. The hairs are fine, but robust.",icon_hide,4,0
1500,Rajang Nerve,7,99,48000,4800,"The source of a Rajang's power, which continues its mystic pulsing after death.",icon_monster_jewel,4,0
1501,Rajang Heart,9,99,120000,12000,A symbol of flesh-searing rage that releases massive power with every beat.,icon_carapace,1,0
1502,Ghoulish Gold Horn,6,99,120000,12000,The golden horn of a furious Rajang. It seems almost too lovely to waste on equipment.,icon_fang,4,0
1503,Ghoulish Gold Gorer,8,99,300000,30000,A golden horn that seethes with rage even now. Not to be touched with bare hands.,icon_fang,4,0
1504,Hyper Rajang Fur,6,99,27300,2730,"Darker than normal Rajang fur, this Hyper scale emits an ominous glow.",icon_hide,4,0
1505,Hyper Rajang Fur X,8,99,81900,8190,"Darker than normal Rajang fur, this Hyper fur emits a steady, ominous glow.",icon_hide,4,0
1506,Deviljho Scale,6,99,21000,2100,"A greenish-black Deviljho scale. It's not often sold, as rumors claim it brings misfortune.",icon_scale,13,0
1507,Deviljho Shard,8,99,63000,6300,"A heavy, high-quality Deviljho scale. Rumored to be bad luck, but is excellent material.",icon_scale,13,0
1508,Deviljho Crook,9,99,150000,15000,An unsettling scale that became warped as it absorbed the hate of the Deviljho's various prey.,icon_mantle,13,0
1509,Deviljho Hide,6,99,28000,2800,Black hide that is oddly slimy and difficult to forge with.,icon_hide,13,0
1510,Deviljho Blackpiel,8,99,54000,5400,Thick hide taken from a violent Deviljho. Especially slimy and difficult to forge with.,icon_hide,13,0
1511,Bloodied Ebonhide,8,99,104100,10410,A hide bloodied and battered from ceaseless hunts that give it no time to dry.,icon_hide,10,0
1512,Deviljho Tallfang,6,99,29800,2980,A large fang from a maw of alarming size. Helps the vile beast sate its hunger.,icon_fang,13,0
1513,Deviljho Hardfang,8,99,89400,8940,"A massive fang that tears, crushes, and grinds prey without mercy.",icon_fang,13,0
1514,Vile Fang,8,99,89400,8940,"A massive, overgrown fang that can chomp through anything. Filled with pure evil.",icon_fang,13,0
1515,Deviljho Talon,6,99,26000,2600,"A dangerously sharp, hooked talon. Inexperienced crafters risk serious injury.",icon_fang,13,0
1516,Deviljho Ripper,8,99,63000,6300,"An incredibly sharp, rigid talon. Even experienced handlers can be injured if not careful.",icon_fang,13,0
1517,Deviljho Scalp,6,99,38000,3800,Removing this part of a Deviljho's skull releases an unimaginably putrid odor.,icon_carapace,13,0
1518,Deviljho Tail,6,99,40000,4000,A massive tail resembling a giant leech. Some folks are out to collect these exclusively.,icon_carapace,13,0
1519,Deviljho Flail,8,99,92000,9200,A large slab of a Deviljho's leech-like tail. Even so-called experts are shocked by it.,icon_carapace,13,0
1520,Deviljho Saliva,6,99,17000,1700,The symbol of a Deviljho's insatiable appetite. The strong acid corrodes all it touches.,icon_liquid,13,0
1521,Black Blood,6,99,51000,5100,Dark black blood characteristic of a Deviljho. It feels like it may jump up and attack at any time.,icon_liquid,1,0
1522,Spattered Hide,6,99,54000,5400,"A jet black hide with a slimy, tar-like sheen: dried blood spatter, some insist.",icon_hide,10,0
1523,Deviljho Gem,7,99,97000,9700,A precious gem said to contain a Deviljho's might. Used in shady rituals.,icon_monster_jewel,13,0
1524,Hyper Deviljho Scale,6,99,25200,2520,"Darker than normal Deviljho scales, this Hyper scale emits an ominous glow.",icon_scale,13,0
1525,Hyper Deviljho Scale X,8,99,75600,7560,"Darker than normal Deviljho scales, this Hyper scale emits a steady, ominous glow.",icon_scale,13,0
1526,Kirin Thunderhorn,4,99,18000,1800,"The horn of Kirin, as powerful as a lightning bolt. Exquisite material.",icon_fang,0,0
1527,Kirin Hide,4,99,6800,680,"A rare and lovely hide, but difficult to carve loose and dangerous to handle.",icon_hide,0,0
1528,Kirin Hide+,6,99,21000,2100,A rare and lovely hide. This one is undamaged: proof of its former owner's strength.,icon_hide,0,0
1529,Kirin Finehide,8,99,97500,9750,Beautiful Kirin hide that hunters can only fantasize of obtaining.,icon_hide,0,0
1530,Kirin Mane,4,99,25000,2500,"A rare, dashing mane that retains its dignity even after being cut free.",icon_carapace,0,0
1531,Platinum Mane,8,99,156200,15620,Kirin mane that sparkles like platinum. It shimmers when kissed by the wind. Priceless.,icon_carapace,0,0
1532,Kirin Thundertail,6,99,40000,4000,"A rare tail, overflowing with elegance, charged with electricity.",icon_carapace,0,0
1533,Kirin Thunderlash,8,99,100000,10000,The highly rare tail of Kirin. The electricity stored within causes it to glimmer.,icon_carapace,0,0
1534,Kirin Azure Horn,6,99,54000,5400,"An azure horn, rare even among Kirin Horns. Gives off a divine light.",icon_fang,3,0
1535,Kirin Azure Peak,8,99,135000,13500,A dangerous horn containing the charge of the thousand bolts that struck it.,icon_fang,3,0
1536,Daora Shell,4,99,13000,1300,The shining silver Kushala Daora shell is solid and highly useful.,icon_shell,10,0
1537,Daora Carapace,6,99,39000,3900,A shell hardened by time. Crafting it is incredibly difficult.,icon_shell,10,0
1538,Daora Cortex,8,99,78000,7800,The repeated molting of skin has made this shell near impregnable.,icon_shell,10,0
1539,Daora Scale,4,99,8000,800,A scale that glows a dull silver. Hard enough to serve as an abrasive for weapons.,icon_scale,10,0
1540,Daora Dragon Scale+,6,99,20000,2000,High-quality scale from Kushala Daora. It is said to surpass steel.,icon_scale,10,0
1541,Daora Shard,8,99,97500,9750,A thick scale from Kushala Daora. The winters have made it strong and cold to the touch.,icon_scale,10,0
1542,Daora Webbing,4,99,18000,1800,Hard to craft but highly compatible with metals. Valued for its light weight.,icon_webbing,10,0
1543,Daora Fellwing,8,99,160000,16000,"A curious wing that's strong as steel, but soft to the touch. Highly sought after material.",icon_carapace,10,0
1544,Daora Horn,4,99,24500,2450,The gallant horn of Daora. Using it requires extra- ordinary experience.,icon_fang,10,0
1545,Daora Hardhorn,8,99,180000,18000,"A hard, ferocious horn that engulfs everything in a freezing wind on impact.",icon_fang,10,0
1546,Daora Horn+,6,99,90000,9000,A fierce-looking horn that instantly robs the body of cold if handled improperly.,icon_fang,10,0
1547,Daora Tail,4,99,22500,2250,Cut from Kushala Daora. Incredibly destructive power contained within.,icon_carapace,10,0
1548,Daora Lash,8,99,175000,17500,"The durable tail of Kushala Daora. As strong as any storm, but flexible as well.",icon_carapace,10,0
1549,Daora Claw,4,99,21000,2100,"Kushala Daora's claw. As hard as ore, it cannot be used by ordinary crafters.",icon_fang,10,0
1550,Daora Claw+,6,99,63000,6300,Even now the black gleam of this claw seems to emit a life force.,icon_fang,10,0
1551,Daora Hardclaw,8,99,137500,13750,A robust claw one might mistake for steel. Enhances equipment capabilities.,icon_fang,10,0
1552,Daora Gem,7,99,120000,12000,A rare gem formed inside a Daora. Its glow is breathtaking.,icon_monster_jewel,10,0
1553,Lrg Elder Dragon Gem,9,99,180000,18000,"A giant, ultra-rare stone that forms inside an Elder Dragon once in a millennium.",icon_monster_jewel,5,0
1554,Chameleos Hide,4,99,12500,1250,"This hide is so strange to the touch, you'll want to rub it all over your face.",icon_hide,5,0
1555,Chameleos Hide+,6,99,37500,3750,"Superior hide of Chameleos. Strange to the touch, but very durable.",icon_hide,5,0
1556,Chameleos Finehide,8,99,95000,9500,Top-grade Chameleos hide. Its strange texture calms the soul of those who touch it.,icon_hide,5,0
1557,Chameleos Horn,4,99,26800,2680,Faintly glows with a white light. Great for interior decorating.,icon_fang,5,0
1558,Chameleos Spike,6,99,80400,8040,"A sharp horn of a Chameleos. Strong and hard, but strangely easy to work with.",icon_fang,5,0
1559,Chameleos Hardhorn,8,99,222500,22250,A super-hard horn that refracts light. A highly sought commodity.,icon_fang,5,0
1560,Chameleos Claw,4,99,28000,2800,"Thin, yet incredibly strong and very easy to work with during crafting.",icon_fang,5,0
1561,Chameleos Claw+,6,99,84000,8400,"Sharpened claw of a Chameleos. Small and sharp, but still valued for being easy to work with.",icon_fang,5,0
1562,Chameleos Hardclaw,8,99,235200,23520,A tough Chameleos claw. Its slender sharpness and strength make it an exceptional weapon.,icon_fang,5,0
1563,Chameleos Webbing,4,99,17600,1760,"Thin, light wing webbing. The inner part of the webbing is highly durable.",icon_webbing,5,0
1564,Chameleos Fellwing,8,99,146200,14620,"A top-grade Chameleos wing. The strong, firm frame makes it invaluable as material.",icon_carapace,5,0
1565,Chameleos Tail,4,99,38000,3800,The distinctive tail of Chameleos. Feels very strange.,icon_carapace,5,0
1566,Chameleos Lash,8,99,176200,17620,"The tough, hard tail of Chameleos. The unique texture makes for excellent material.",icon_carapace,5,0
1567,Chameleos Gem,7,99,100000,10000,A rare gem formed inside Chameleos. It has a multi-colored glow.,icon_monster_jewel,5,0
1568,Teostra Shell,4,99,18000,1800,The red hot shell of Teostra. It proves its domain over all fire.,icon_shell,1,0
1569,Teostra Carapace,6,99,45000,4500,Harder than Teostra Shell. Looks like red-hot steel; particularly eye catching.,icon_shell,1,0
1570,Teostra Cortex,8,99,90000,9000,Merely looking upon this heavy shell is enough to shatter the hearts of hardened warriors.,icon_shell,1,0
1571,Teostra Mane,4,99,19000,1900,This majestic mane is a sure sign of Teostra's regality.,icon_carapace,1,0
1572,Teostra Tail,4,99,25000,2500,"Covered in red scales, the tree like tail of Teostra is incredibly hard to cut.",icon_carapace,1,0
1573,Teostra Lash,8,99,177500,17750,The stone-hard tail of Teostra. A lash from this tail unleashes unimaginable explosions.,icon_carapace,1,0
1574,Teostra Horn,4,99,20000,2000,A horn that displays the power of Teostra. Hunters wither before its might.,icon_fang,1,0
1575,Teostra Horn+,6,99,60000,6000,A sharp horn that burns with the fury of Teostra. It is tinged with fire.,icon_fang,1,0
1576,Teostra Hardhorn,8,99,220000,22000,A majestic horn that commands all who gaze upon it to bend the knee.,icon_fang,1,0
1577,Fire Dragon Scale,4,99,10500,1050,A scalding hot scale. It'll take your fingerprints right off.,icon_scale,1,0
1578,Fire Dragon Scale+,6,99,21000,2100,A scale from a majestic fire dragon. It burns with hot fire from within.,icon_scale,1,0
1579,Flame Shard,8,99,92500,9250,The highest quality scale from Teostra. Hunters can only dream of finding one.,icon_scale,1,0
1580,Fire Dragon Claw,4,99,12000,1200,"A sharp, glowing Fire Dragon claw. Hard even for experts to craft.",icon_fang,1,0
1581,Teostra Claw+,6,99,53000,5300,A death sentence to he who tries to elude the dragon's flames. Still feels hot.,icon_fang,1,0
1582,Fire Dragon Hardclaw,8,99,132500,13250,"A hard, fiery Teostra claw. It causes anything it scratches to burst into flames.",icon_fang,1,0
1583,Teostra Webbing,4,99,16000,1600,Wing webbing carved from a fire dragon. A marvelous material with many uses.,icon_webbing,1,0
1584,Teostra Powder,6,99,32500,3250,Powder from fire dragon wings. Said to magnify a material's abilities.,icon_sac,1,0
1585,Teostra Gem,7,99,120000,12000,A rare gem formed inside a fire dragon. Flickers with ferocious flames.,icon_monster_jewel,1,0
1586,Wyvern Crystal,6,99,43000,4300,A mysterious crystal that glows with the energy of both light and dark spirits.,icon_ore,6,0
1587,Great Wyvern Crystal,8,99,129000,12900,A mysterious crystal of light and dark spirits. The owner is said to gain godlike powers.,icon_ore,6,0
1588,Akantor Scale+,6,99,42720,4272,"Faintly glittering Akantor Scale. It will not melt, even if dipped in lava.",icon_scale,10,0
1589,Akantor Shard,8,99,106800,10680,A splendid scale with a faint glow. Requires cooling after all that time in lava.,icon_scale,10,0
1590,Akantor Carapace,6,99,55800,5580,"Shining Akantor Shell. Exceptionally hard, and thus difficult to craft.",icon_shell,10,0
1591,Akantor Cortex,8,99,139500,13950,Bulky plating with a faint glow. Deters most attacks and repels the rest.,icon_shell,10,0
1592,Akantor Tail,6,99,80000,8000,The large rock-like tail of an Akantor. Strong enough to gouge the earth.,icon_carapace,10,0
1593,Akantor Flail,8,99,200000,20000,A barbed tail that razes the earth and knocks the fight right out of prey.,icon_carapace,10,0
1594,Akantor Hardclaw,6,99,57000,5700,Hard Akantor claw that can smash bedrock. Its victims are left unrecognizable.,icon_fang,10,0
1595,Akantor Shredtalon,8,99,142500,14250,An earth-shredding claw that destroys anything caught in the Akantor's charge.,icon_fang,10,0
1596,Akantor Tallfang,6,99,85000,8500,Huge fang that can pierce the heavens. It has passed through many foes.,icon_fang,10,0
1597,Akantor Greatfang,8,99,212500,21250,One of a pair of towering fangs. The hard base makes it ideal equipment material.,icon_fang,10,0
1598,Akantor Spike,6,99,95000,9500,A flawless spike from an Akantor. It can easily scar rock.,icon_carapace,10,0
1599,Akantor Thickspike,8,99,237500,23750,"A thick, sturdy shell spike believed to have evolved as defense against larger foes.",icon_carapace,10,0
1600,Akantor Gem,7,99,150000,15000,A gem that once belonged to the Ancient World-King. Its aura resists new ownership.,icon_monster_jewel,1,0
1601,Conquest Sphere,9,99,300000,30000,A gem said to grant dominion over everything under the sun. Courses with ambition.,icon_mantle,1,0
1602,Ukanlos Carapace,6,99,55800,5580,The minerals encrusted in this cold-infused shell make it surprisingly strong.,icon_shell,0,0
1603,Ukanlos Cortex,8,99,152500,15250,The minerals encrusted in this cold-infused cortex make it surprisingly strong.,icon_shell,0,0
1604,Ukanlos Underscale,6,99,45000,4500,"A thick, sharp belly scale. Cuts through snow, allowing Ukanlos to move easier.",icon_scale,0,0
1605,Ukanlos Underscale+,8,99,112500,11250,"A thick, sharp belly scale. Used to get around by cutting through the ice.",icon_scale,0,0
1606,Ukanlos Tail,6,99,80000,8000,The icy tail of Ukanlos. A single lash makes the air scream and the earth cry.,icon_carapace,0,0
1607,Ukanlos Flail,8,99,200000,20000,"A giant, icy Ukanlos tail. One swipe makes the air scream and glaciers crack.",icon_carapace,0,0
1608,Ukanlos Digger,6,99,57000,5700,An Ukanlos claw. Repeated voyages through the ice have twisted its shape.,icon_fang,0,0
1609,Ukanlos Digger+,8,99,142500,14250,An impossibly massive claw with ridges used to pull the monster onto the ice.,icon_fang,0,0
1610,Ukanlos Shoveljaw,6,99,95000,9500,"Ukanlos's shovel-like jaw. Developed to shovel snow, one scoop can cause an avalanche.",icon_carapace,0,0
1611,Ukanlos Shoveljaw+,8,99,237500,23750,A prominent jaw that makes for a real spectacle when it smashes apart hunks of ice.,icon_carapace,0,0
1612,Ukanlos Fin+,6,99,85000,8500,A huge dorsal fin with saw-like ridges at the tip that cut through anything.,icon_carapace,0,0
1613,Ukanlos Strongfin,8,99,212500,21250,"A giant, saw-like fin that runs along the Ukanlos's back. Cuts through all.",icon_carapace,0,0
1614,Ukanlos Gem,7,99,150000,15000,A gem owned by a king who nearly ended the world. It seeks to destroy new owners.,icon_monster_jewel,6,0
1615,Ukanlos Stone,9,99,300000,30000,A legendary Ukanlos stone. Those who craft it rule the earth and seize the sky.,icon_mantle,0,0
1616,Alatreon Scute,6,99,53800,5380,"A unique plating that can protect against attacks, and even deflect blows.",icon_shell,5,0
1617,Alatreon Pallium,8,99,107600,10760,A miraculous plate impervious to all attacks. Legend says the bearer receives heaven's love.,icon_shell,5,0
1618,Alatreon Plate,6,99,29600,2960,This particular Alatreon scale grows in backwards. It is as sharp as a blade.,icon_scale,5,0
1619,Alatreon Mantle,8,99,162500,16250,"The mantle of Alatreon is the stuff of legend, containing traces of every element within.",icon_scale,5,0
1620,Alatreon Talon,6,99,34200,3420,A talon capable of making weapons of untold power. Ridiculously sharp.,icon_fang,5,0
1621,Alatreon Riptalon,8,99,227500,22750,The mere sight of this deadly talon calls forth images of terrible weapons made from it.,icon_fang,5,0
1622,Alatreon Webbing,6,99,72000,7200,"At times this looks like a dark abyss; at others, like the coming of first light.",icon_carapace,5,0
1623,Alatreo Direwing,8,99,144000,14400,This vile wing can cut through time and space to destroy the entire world...say the rumors.,icon_carapace,5,0
1624,Alatreon Tail,6,99,97200,9720,"The tail from an Alatreon, previously thought to only have existed in legend.",icon_carapace,5,0
1625,Alatreo Diretail,8,99,145800,14580,"""Is this a dream?"" ""Am I alive?"" Those who grasp this tail begin to harbor such doubts.",icon_carapace,5,0
1626,Broken Skypiercer,6,99,38000,3800,A piece of the horn from atop an Alatreon's head. Broken due to the difficulty harvesting it.,icon_fang,5,0
1627,Skypiercer,7,99,100000,10000,Part of an Alatreon's convoluted horns.,icon_fang,5,0
1628,Skyswayer,9,99,160000,16000,Part of an Alatreon's convoluted horns. The finest specimen known to exist.,icon_fang,5,0
1629,Azure Dragongem,7,99,200000,20000,The legend to beat all legends. It is said to bring about the end of those who obtain it.,icon_mantle,3,0
1630,Azure Dragonsphire,9,99,400000,40000,Legend says the discovery of this brilliant gem heralds the end of the world.,icon_mantle,3,0
1631,Amatsu Carapace,6,99,50000,5000,Black armor beaten by fierce winds into powerful defense for a celestial god.,icon_shell,0,0
1632,Amatsu Cortex,8,99,110000,11000,"This black armor, forged by the storm for a malevolent god, is almost unmatched in strength.",icon_shell,0,0
1633,Amatsu Webbing,6,99,40000,4000,"Ethereal robes that make one appear to float, like something out of a fable.",icon_webbing,0,0
1634,Amatsu Membrane,8,99,88000,8800,"Legendary material that, when worn, can even allow the wearer to float for a short time.",icon_webbing,0,0
1635,Amatsu Horn,6,99,100000,10000,A horn carved from an Amatsu. The unblemished horns are proof of its strength.,icon_fang,0,0
1636,Amatsu Hardhorn,8,99,220000,22000,A horn carved from an Amatsu. It was grown in the midst of ferocious storms.,icon_fang,0,0
1637,Amatsu Claw+,6,99,60000,6000,The incredibly sharp claw of an Amatsu. Just seeing the claw will instill fear of its owner.,icon_fang,0,0
1638,Amatsu Hardclaw,8,99,132000,13200,The incredibly sharp claw of an Amatsu. Just seeing the claw inspires intense fear.,icon_fang,0,0
1639,Amatsu Tail,6,99,95000,9500,"The tail of the Storm Dragon. It is very tough, which helps maneuverability in the storm.",icon_carapace,0,0
1640,Amatsu Stormtail,8,99,209000,20900,The gorgeous tail of the Storm Dragon. Its dancing movements are said to call the storm.,icon_carapace,0,0
1641,Amatsu Pleura,6,99,90000,9000,A chestplate that is said to steal the future of those who bathe in its passionate light.,icon_carapace,0,0
1642,Amatsu Heavypleura,8,99,198000,19800,A heavy chestplate whose light emits despair. The passion it inspires is particularly strong.,icon_carapace,0,0
1643,Storm Vesicle,6,99,48000,4800,Unique organ that stores large amounts of water. Even a sliver can power up your gear.,icon_sac,0,0
1644,Storm Vesicle Clump,8,99,105600,10560,A particularly well-developed organ that stores enough water to wash away the world.,icon_sac,0,0
1645,Heavenly Dragongem,7,99,200000,20000,The root of the celestial gods' power. It grants their far-reaching vision.,icon_mantle,6,0
1646,Heavenly Dragonsphire,9,99,300000,30000,The root of the celestial gods' power. It grants their far-reaching vision.,icon_mantle,6,0
1647,Dragon Healing Crystal,8,99,50000,5000,A hard crystal made from dragon scales. Valued as medicine. (Account Item),icon_ore,10,1
1648,Lao-Shan Shard,8,99,112500,11250,The thick scale of Lao-Shan. Its hardness is on par with any wyvern cortex.,icon_scale,1,0
1649,Lao-Shan Cortex,8,99,152500,15250,An unbelievably heavy shell from Lao-Shan. The ages have made this shell immortal.,icon_shell,1,0
1650,Lao-Shan Hardhorn,8,99,160000,16000,Horn from a Lao-Shan Lung snout. Perfectly formed even without forging -- a true luxury item.,icon_fang,1,0
1651,Lao-Shan Megaclaw,8,99,129600,12960,A Lao-Shan Lung claw. So gigantic that even skilled artisans find themselves unable to work it.,icon_fang,1,0
1652,Lao-Shan Mantle,9,99,300000,30000,A legendary scale of Lao-Shan. Those who craft it rule the earth and seize the sky.,icon_mantle,1,0
1653,Fatalis Shard,8,99,139500,13950,"A thick, jet-black scale that covers the body of Fatalis. Grows thick with age.",icon_scale,10,0
1654,Fatalis Cortex,8,99,106800,10680,"Harder than a Fatalis shell, it's also known as Mediastinum.",icon_shell,10,0
1655,Fatalis Hardhorn,8,99,196500,19650,A horn of immense strength. The black glow of the horn gives off a strange attraction.,icon_fang,10,0
1656,Fatalis Evil Eye,8,99,280000,28000,An unusual aura surrounds the eye of Fatalis. Perhaps it's possessed...,icon_carapace,4,0
1657,Fatalis Fellwing,8,99,225000,22500,"A wing hard as any metal, yet still very malleable. Only the most skilled can work with it.",icon_carapace,10,0
1658,Crimson Fatalis Scale,8,99,136500,13650,The scale of a Fatalis overcome with rage. Crimson fire hides a deep darkness.,icon_scale,1,0
1659,Crimson Fatalis Shell,8,99,106800,10680,The shell of a Fatalis overcome with rage. It shines an unforgiving crimson.,icon_shell,1,0
1660,Crimson Fatalis Horn,8,99,196500,19650,The horn of a Fatalis overcome with rage. It looks ready to tear down the sky.,icon_fang,1,0
1661,Crimson Fatalis Wing,8,99,237500,23750,The wing of a Fatalis overcome with rage. The air fears its crimson pulse.,icon_carapace,1,0
1662,Fatalis Devileye+,8,99,325000,32500,The eye of a Fatalis overcome with rage. Its wicked gaze devours one's courage.,icon_carapace,1,0
1663,Old Fatalis Shard,8,99,181300,18130,A sparkling white scale of an ancient Fatalis. Its beauty can capture your heart.,icon_scale,0,0
1664,Old Fatalis Cortex,8,99,173910,17391,A sparkling white shell of an ancient Fatalis. Heavier and stronger than most parts.,icon_shell,0,0
1665,Old Fatalis Hardhorn,8,99,255400,25540,A sparkling white horn of an ancient Fatalis. Said to be lightning personified.,icon_fang,0,0
1666,Old Fatalis Fellwing,8,99,292500,29250,A sparkling white wing of an ancient Fatalis. To gaze upon it is to know true oppression.,icon_carapace,0,0
1667,Old Fatalis Souleye,8,99,338000,33800,"A crimson eye, fierce and unforgiving, that gazes back with red, electric finality.",icon_carapace,1,0
1668,Nakarkos Husk,4,99,17600,1760,"The outer shell covering the Nakarkos. Used for crafting, but not much else is known.",icon_bone,0,0
1669,Nakarkos Husk+,6,99,53000,5300,Bones that have become hardened somehow due to the fluid of a Nakarkos.,icon_bone,0,0
1670,Heavy Nakarkos Husk,8,99,132500,13250,These bones have become impossibly hard after years of soaking in Nakarkos fluid.,icon_bone,0,0
1671,Nakarkos Shell,4,99,13600,1360,The outer shell covering the Nakarkos. Its properties make for great armor.,icon_shell,0,0
1672,Nakarkos Shell+,6,99,41000,4100,"A spiny outer shell, it has undergone many changes over time, making it quite unique.",icon_shell,0,0
1673,Nakarkos Hardshell,8,99,102500,10250,The outer shell covering the Nakarkos. Its hardness makes truly top-class armor.,icon_shell,0,0
