_id,name,rarity,carry_capacity,buy,sell,description,icon_name,icon_color,account
906,Agnaktor Tail,6,99,37500,3750,A tail carved from an Agnaktor. The going price is low due to lack of demand.,icon_carapace,1,0
907,Scalding Pleura+,6,99,21600,2160,"A chestplate made from ore fusing together over a number of years. Won't melt, despite the heat.",icon_carapace,1,0
908,Scorching Pleura,8,99,64800,6480,A burning chestplate tempered for ages. The various ores fused within are the key to its strength.,icon_carapace,1,0
909,Hyper Agnaktor Shell,6,99,20100,2010,"Darker than normal Agnaktor shell, this Hyper shell emits an ominous glow.",icon_shell,1,0
910,Hyper Agnaktor Cortex,8,99,60300,6030,"Darker than normal Agnaktor shell, this tough Hyper shell emits an ominous glow.",icon_shell,1,0
911,Tetsucabra Scale,4,99,3200,320,A scale with red and black patches that blends in well with cavern environments.,icon_scale,1,0
912,Tetsucabra Scale+,6,99,9600,960,A fine red-and-black scale. The top pick for artisans who want the time-hardened best.,icon_scale,1,0
913,Tetsucabra Shard,8,99,28800,2880,"A thick, red-and-black scale so hard that people justi- fiably mistake it for rock.",icon_scale,1,0
914,Tetsucabra Shell,4,99,2200,220,A flexible yet hard rubber- like shell. In high demand as an armor forging material.,icon_shell,1,0
915,Tetsucabra Carapace,6,99,6600,660,"A flexible, highly durable shell that makes comfortable and easy-to-move-in armor.",icon_shell,1,0
916,Tetsucabra Cortex,8,99,19800,1980,"Tough, rubbery plating that is difficult to break. A popular equipment material.",icon_shell,1,0
917,Tetsucabra Claw,4,99,5800,580,"A powerful claw that can pulverize rock. Short, but worth the effort to obtain.",icon_fang,1,0
918,Tetsucabra Claw+,6,99,17400,1740,A powerful claw that can pulverize rock. Creates scratch-proof equipment.,icon_fang,1,0
919,Tetsucabra Hardclaw,8,99,52200,5220,A powerful claw that can smash through boulders. Challenging to forge with.,icon_fang,1,0
920,Tetsucabra Tusks,4,99,10200,1020,"A giant, shovel-like jaw, complete with tusks used for attacking and movement.",icon_fang,1,0
921,Tetsucabra Tusks+,6,99,30600,3060,A jaw with oversized tusks. Recent finds reveal damaged tusks grow back even harder.,icon_fang,1,0
922,Tetsucabra Gnawrl,8,99,91800,9180,A fang that grows like a mighty tree. Lost fangs are replaced by stronger ones.,icon_fang,1,0
923,Dignified Skull,5,99,7600,760,A distinctly warped skull that is far more durable than normal bone.,icon_bone,1,0
924,Vicious Visage,9,99,68400,6840,A skull with opposing fangs and a sturdy lower jaw whose evolution warrants study.,icon_bone,1,0
925,Paddock Oil,4,99,2000,200,A mysterious oil found only in nature. Used at the Smithy as a lubricant and additive.,icon_liquid,11,0
926,Paddock Oil+,6,99,6000,600,A mysterious oil found only in nature. Purer oil yields higher forge temperatures.,icon_liquid,11,0
927,Paddock Cream,8,99,18000,1800,A mysterious oil found only in nature. Used at the Smithy as a lubricant and additive.,icon_liquid,11,0
928,Hyper Tetsu. Scale,6,99,11500,1150,"Darker than normal Tetsucabra scales, this Hyper scale emits an ominous glow.",icon_scale,1,0
929,Hyper Tetsu. Shard,8,99,34500,3450,"Darker than normal Tetsucabra scales, this tough Hyper scale emits an ominous glow.",icon_scale,1,0
930,Drilltusk Scale,6,99,4500,450,A Drilltusk Tetsucabra scale. It's hard and features a unique red and blue pattern.,icon_scale,14,0
931,Drilltusk Scale+,7,99,13500,1350,A hard scale of a Drilltusk Tetsucabra. It's sharp and features a unique pattern.,icon_scale,14,0
932,Drilltusk Shard,9,99,40500,4050,A thick scale of a Drilltusk Tetsucabra. Unbelievably hard with a unique pattern.,icon_scale,14,0
933,Drilltusk Shell,6,99,3100,310,A Drilltusk Tetsucabra shell. It's quite hard and has a unique red and blue pattern.,icon_shell,14,0
934,Drilltusk Carapace,7,99,9300,930,A Drilltusk Tetsucabra carapace. Its thickness makes it quite hard.,icon_shell,14,0
935,Drilltusk Cortex,9,99,27900,2790,An unbelievably tough Drilltusk Tetsucabra carapace with a unique pattern.,icon_shell,14,0
936,Drilltusk Tusk,6,99,14300,1430,The tusk of a Drilltusk Tetsucabra. Used to dig up large boulders.,icon_fang,14,0
937,Drilltusk Tusk+,7,99,42900,4290,A massive Drilltusk Tetsucabra tusk. An extension of its jaw and its brutality.,icon_fang,14,0
938,Drilltusk Gnawrl,9,99,107200,10720,A giant fang that is hard and sharp enough to grind a mountain to powder.,icon_fang,14,0
939,Sharqskin Scale,6,99,3600,360,Zamite skin that feels smooth or coarse depending on which way you rub it.,icon_scale,6,0
940,Meaty Hide+,6,99,2800,280,The hide from the underbelly of a Zamite. The most elastic samples are costly.,icon_hide,6,0
941,Zamtrios Hide+,6,99,12300,1230,"A fine, stretchy hide. It tears only after new, harder skin has formed underneath.",icon_hide,6,0
942,Zamtrios Piel,8,99,36900,3690,"A thick, elastic hide with high Ice resistance. Like wearing winter, yet warm.",icon_hide,6,0
943,Zamtrios Scale+,6,99,22200,2220,A fine scale that functions like sandpaper. Used to hone the edges of weapons.,icon_scale,6,0
944,Zamtrios Shard,8,99,66600,6660,"One of many thick, razor- sharp scales that shred any foolish enough to touch.",icon_scale,6,0
945,Zamtrios Fin+,6,99,24900,2490,A quality dorsal fin that's in high demand. Big fins go for a premium at market.,icon_carapace,6,0
946,Zamtrios Grandfin,8,99,74700,7470,A huge dorsal fin that cuts gracefully through the ice. Loved by artisans and hunters.,icon_carapace,6,0
947,Zamtrios Sawtooth,6,99,36000,3600,A blunt tooth that slowly and painfully tears through the Zamtrios's prey.,icon_fang,6,0
948,Zamtrios Sawtooth+,8,99,90000,9000,"Triangular, saw-like teeth for biting and crushing. Will grow back if pulled out.",icon_fang,6,0
949,Zamtrios Tailblade,6,99,32400,3240,A razor-sharp tail that does as well as any axe if one brings it down hard.,icon_carapace,6,0
950,Zamtrios Tailbrand,8,99,81000,8100,A large tail whose meaty swings can knock prey out with a single lash.,icon_carapace,6,0
951,Hyper Zamtrios Hide,6,99,14800,1480,"Darker than normal Zamtrios hide, this Hyper hide emits an ominous glow.",icon_hide,6,0
952,Hyper Zamtrios Piel,8,99,44400,4440,"Darker than normal Zamtrios hide, this tough Hyper hide emits an ominous glow.",icon_hide,6,0
953,Najarala Shell,4,99,4800,480,A shell that grows both large and small -- whatever won't impede movement.,icon_shell,11,0
954,Najarala Ampsounder,8,99,73800,7380,"A special plate that ampli- fies sound, getting messages across loud and clear.",icon_carapace,11,0
955,Najarala Carapace,6,99,14400,1440,A long shell that covers the Najarala and may have evolved from a scale.,icon_shell,11,0
956,Najarala Cortex,8,99,43200,4320,"The hardest part of the carapace. Multiple, layered plates provide durability.",icon_shell,11,0
957,Najarala Hide,4,99,6000,600,Comparatively flexible hide found under the shell and on the underbelly.,icon_hide,11,0
958,Najarala Hide+,6,99,18000,1800,"A fine, silky-smooth hide that sells well at market as a top-class material.",icon_hide,11,0
959,Najarala Piel,8,99,54000,5400,The finest of Najarala hides. Often used in all kinds of leatherwork.,icon_hide,11,0
960,Najarala Marrow,5,99,21000,2100,Marrow known to cause paralysis if handled improperly.,icon_carapace,11,0
961,Najarala Medulla,7,99,63000,6300,A mass of tissue used as a coagulant in all manner of crafts.,icon_carapace,11,0
962,Najarala Sounder,4,99,8200,820,A Najarala shell with unique acoustic properties that amplify sound.,icon_carapace,11,0
963,Najarala Sounder+,6,99,24600,2460,A shell with unique acoustic properties. Fragile and a real challenge to work with.,icon_carapace,11,0
964,Najarala Fang,4,99,7500,750,A fang containing an organ that induces neurogenic paralysis.,icon_fang,11,0
965,Chilling Beak,5,99,24000,2400,"The Najarala's bird-like beak, which it uses to instantaneously seize prey.",icon_bone,11,0
966,Heart-stopping Beak,9,99,96000,9600,The Najarala's unique beak. Fangs inside it neutralize prey in ghastly fashion.,icon_bone,11,0
967,Hyper Najarala Shell,6,99,17300,1730,"Darker than normal Najarala shell, this Hyper shell emits an ominous glow.",icon_shell,11,0
968,Hyper Najarala Cortex,8,99,51900,5190,"Darker than normal Najarala shell, this tough Hyper shell emits an ominous glow.",icon_shell,11,0
969,Black Pearl,4,99,1500,150,A pearl with a black glow. Fetches a high price.,icon_scale,10,0
970,Fine Black Pearl,8,99,19500,1950,Largest and most beautiful of all black pearls. Very valuable and hard to find.,icon_scale,10,0
971,Wyvern Scalp,4,99,7800,780,A Carapaceon shell made from a wyvern's skull.,icon_carapace,10,0
972,Heavy Wyvern Scalp,8,99,70200,7020,A Carapaceon shell made from a wyvern's skull that is harder than normal.,icon_carapace,10,0
973,Decayed Crimson Horn,4,99,5300,530,"A red horn from a shelled monster. Despite the decay, it remains extremely durable.",icon_fang,1,0
974,Timeworn Crimson Horn,8,99,41300,4130,A faded horn which has been weathered over time but still has some value.,icon_fang,1,0
975,Sm. Hermitaur Shell,4,99,450,45,A piece of bone from a giant Carapaceon. Its small form means it has limited use.,icon_shell,1,0
976,Tiny Hermitaur Shell,8,99,4000,400,A tiny piece of bone from a giant Carapaceon. It may be small but its value depends on its use.,icon_shell,1,0
977,Hermitaur Shell,4,99,5500,550,A large piece of exoskeleton that's surprisingly light and easy to use in crafting.,icon_shell,1,0
978,Hermitaur Carapace,6,99,16500,1650,The hard carapace of a Daimyo Hermitaur. Harder than shell to work.,icon_shell,1,0
979,Hermitaur Cortex,8,99,42900,4290,A Daimyo Hermitaur's tough bone shell. Its thickness makes for strong armor.,icon_shell,1,0
980,Hermitaur Claw,4,99,9750,975,A giant claw from a Daimyo Hermitaur. The sharp claw can slice through rock.,icon_fang,1,0
981,Hermitaur Claw+,6,99,29300,2930,Sharp claw from a Daimyo Hermitaur. As hard as metal.,icon_fang,1,0
982,Hermitaur Hardclaw,8,99,76000,7600,A Daimyo Hermitaur's hard claw. Tough enough to fortify castles.,icon_fang,1,0
983,Hyper Hermitaur Scale,6,99,19800,1980,"Darker than normal Hermitaur scales, this Hyper scale emits an ominous glow.",icon_shell,1,0
984,Hyper Hermitaur Cortex,8,99,59400,5940,"Darker than normal Hermitaur scales, this tough Hyper scale emits an ominous glow.",icon_shell,1,0
985,Stonefist Shell,6,99,7700,770,The shell from a Stonefist Hermitaur. It has grown hard and dark over its many years.,icon_shell,14,0
986,Stonefist Carapace,7,99,23100,2310,A hardened Stonefist Hermitaur shell. It has grown hard and dark over its many years.,icon_shell,14,0
987,Stonefist Cortex,9,99,69300,6930,A very hard Stonefist Hermitaur shell. It has grown hard and dark over its many years.,icon_shell,14,0
988,Stonefist Claw,6,99,13650,1365,A claw taken from a Stonefist Hermitaur. It has grown hard and dark over its many years.,icon_fang,14,0
989,Stonefist Claw+,7,99,40950,4095,A sharp claw from a Stonefist Hermitaur. It has grown hard and dark over its many years.,icon_fang,14,0
990,Stonefist Talon,9,99,90000,9000,A very sharp Stonefist Hermitaur claw. It has grown hard and dark over its many years.,icon_fang,14,0
991,Small Ceanataur Shell,4,99,550,55,A piece of a giant Ceanataur Shell. Lighter than it looks and easy to craft.,icon_shell,3,0
992,Ceanataur Shell,4,99,7200,720,A giant Shogun Ceanataur Shell. Has a distinctive color and shape.,icon_shell,3,0
993,Ceanataur Carapace,6,99,21600,2160,"Harder than a Ceanataur Shell, this carapace is harder to work with.",icon_shell,3,0
994,Ceanataur Cortex,8,99,54000,5400,"Thicker than normal Ceanataur bone, this high quality material demands a master craftsman.",icon_shell,3,0
995,Ceanataur Leg,4,99,7500,750,A Shogun Ceanataur leg. Incredibly strong to support the beast's massive body.,icon_shell,3,0
996,Ceanataur Leg+,6,99,22500,2250,A giant Shogun Ceanataur leg. Extremely strong to support the beast's massive body.,icon_shell,3,0
997,Heavy Ceanataur Leg,8,99,56200,5620,An extremely thick Shogun Ceanataur leg. The shape is perfect for making weapons.,icon_shell,3,0
998,Ceanataur Claw,4,99,12000,1200,A giant Shogun Ceanataur claw. Those who fall in its path pay a dear price.,icon_fang,3,0
999,Ceanataur Claw+,6,99,35000,3500,The sharp claw of a giant Shogun Ceanataur. It's a true menace to hunters.,icon_fang,3,0
1000,Ceanataur Hardclaw,8,99,87500,8750,A top quality claw from a giant Shogun Ceanataur. Reserved for use in the finest equipment.,icon_fang,3,0
1001,Hyper Ceanataur Shell,6,99,25900,2590,"Darker than normal Ceanataur shell, this Hyper shell emits an ominous glow.",icon_shell,3,0
1002,Hyper Ceanataur Crtx,8,99,77700,7770,"Darker than normal Ceanataur shell, this tough Hyper shell emits an ominous glow.",icon_shell,3,0
1003,Heavy Rustrazor Scalp,9,99,98200,9820,A thick and durable skull bone from inside a Rustrazor Ceanataur.,icon_carapace,15,0
1004,Rustrazor Cortex,9,99,75600,7560,A thick and durable Rustrazor Ceanataur carapace used only by the finest craftsmen.,icon_shell,3,0
1005,Rustrazor Hardclaw,9,99,105000,10500,A hard Rustrazor Ceanataur claw that possesses unrivaled beauty and toughness.,icon_fang,15,0
1006,Nerscylla Carapace,6,99,11700,1170,A white shell popular with women and treated as a top- class material.,icon_shell,0,0
1007,Nerscylla Cortex,8,99,35100,3510,"Thick, opalescent plating with nary a scratch. Trades at an extremely high price.",icon_shell,0,0
1008,Nerscylla Shear,6,99,14400,1440,A venomous fang that expands and contracts at will. Beware its lethal poison!,icon_fang,0,0
1009,Nerscylla Scishorn,8,99,43200,4320,"Stretching, poison-laden fangs found in a Nerscylla's mouth. Perfect for weapons.",icon_fang,0,0
1010,Nerscylla Sharpclaw,6,99,15600,1560,One of the Nerscylla's sharp claws. Prey attacked by this never survives.,icon_fang,0,0
1011,Nerscylla Hardclaw,8,99,46800,4680,An impressive specimen used once its web-weaving owner has danced prey in circles.,icon_fang,0,0
1012,Nerscylla Spike+,6,99,28000,2800,A dorsal spike that is prized for its lethal poison sac more than its sharpness.,icon_carapace,0,0
1013,Nerscylla Surspike,8,99,56000,5600,Spikes from the back whose concentrated poison requires very careful handling.,icon_carapace,0,0
1014,Hyper Nerscylla Cortex,8,99,42100,4210,"Darker than normal Nerscylla shell, this tough Hyper Shell emits an ominous glow.",icon_shell,0,0
1015,Seltas Carapace,6,99,6600,660,A hard piece of exoskeleton whose smooth surface reduces air resistance while flying.,icon_shell,2,0
1016,Seltas Cortex,8,99,19800,1980,A thick but shockingly light piece of exoskeleton made of shock-resistant layers.,icon_shell,2,0
1017,Seltas Innerwing,6,99,8100,810,A vital organ for the flying Seltas. In high demand as a household material.,icon_webbing,2,0
1018,Seltas Razorwing,8,99,24300,2430,Fluid-filled wings that beat at high speeds to grant the Seltas flight.,icon_webbing,2,0
1019,Seltas Horn+,6,99,10800,1080,"A sharp horn popular with artisans because, frankly, it's pretty deadly as is.",icon_fang,2,0
1020,Seltas Hardhorn,8,99,32400,3240,A vicious horn that the Seltas sharpens on boulders as if whetting a blade.,icon_fang,2,0
1021,S.Queen Carapace,6,99,24900,2490,A hard piece of exoskeleton that once made a Seltas Queen a veritable fortress.,icon_shell,13,0
1022,S.Queen Cortex,8,99,56000,5600,"An especially thick, iridescent carapace used in impressive Decorations.",icon_shell,13,0
1023,S.Queen Hardpectus,6,99,26400,2640,A hard shell from the chest. Its non-slip surface exists so males can mount easily.,icon_carapace,13,0
1024,S.Queen Pectus+,8,99,59400,5940,Especially thick chest plating. Nearby gas holes have given it an odd aroma.,icon_carapace,13,0
1025,S.Queen Sharpclaw,6,99,39600,3960,A claw with a non-slip coating. Used mostly for movement and tunneling.,icon_fang,13,0
1026,S.Queen Hardclaw,8,99,89100,8910,"A beefy Seltas Queen claw. Dull, but its high durability suits it for equipment.",icon_fang,13,0
1027,S.Queen Jaw,6,99,37500,3750,A shell that serves as the Seltas Queen's jaw. Used to expel potent breath.,icon_carapace,13,0
1028,S.Queen Maw,8,99,63200,6320,A large jaw that opens laterally to chew through meals with ease.,icon_carapace,13,0
1029,S.Queen Crescent,6,99,42000,4200,Moon-shaped shears that double as a tail. Used for defense when foes approach.,icon_carapace,13,0
1030,S.Queen Moonlash,8,99,70800,7080,"Large shears from the tip of the tail. Inspires servitude from Seltas, fear in humans.",icon_carapace,13,0
1031,S.Queen Extract,6,99,75000,7500,A fluid that circulates through the body. Acidifies when it touches the air.,icon_liquid,13,0
1032,D.S.QueenConcentrate,8,99,140000,14000,An abnormally secreted substance acclaimed for its use in Neopteron forging.,icon_liquid,13,0
1033,Hyper S.Queen Shell,6,99,31700,3170,"Darker than normal S.Queen shell, this Hyper shell emits an ominous glow.",icon_shell,13,0
1034,Hyper S.Queen Cortex,8,99,95100,9510,"Darker than normal Seltas Queen shell, this tough Hyper shell emits an ominous glow.",icon_shell,13,0
1035,Barroth Carapace,6,99,11700,1170,"A Barroth's carapace coated in multiple layers of mud, making it quite rigid.",icon_shell,7,0
1036,Barroth Cortex,8,99,35100,3510,A Barroth's cortex. Years' worth of mud have hardened it beyond all measure.,icon_shell,7,0
1037,Barroth Ridge+,6,99,14400,1440,"A thick, sturdy part of a Barroth backplate. Mud and sunlight have helped to harden it further.",icon_carapace,7,0
1038,Barroth Chine,8,99,43200,4320,"The thickest part of a Barroth's backplate. Mud, sun, and age have made it rock-hard.",icon_carapace,7,0
1039,Barroth Claw+,6,99,15600,1560,A polished claw sharpened by sand and dirt. It can dig through even the toughest earth.,icon_fang,7,0
1040,Barroth Talon,8,99,46800,4680,A strong claw found on only the most formidable of Barroth. It can easily dig through solid rock.,icon_fang,7,0
1041,Barroth Scalp,6,99,36000,3600,This durable part of a Barroth's skull is also the hardest to remove.,icon_carapace,7,0
1042,Barroth Crown,8,99,72000,7200,The heavy scalp of a formidable Barroth. As hard to remove as it is durable.,icon_carapace,7,0
1043,Barroth Tail,6,99,21600,2160,"Barroth tails aren't very valuable, but the meat is hailed as a delicacy.",icon_carapace,7,0
1044,Barroth Lash,8,99,43200,4320,"A rigid tail carved from a select few Barroth. Inexpensive, but surprisingly versatile.",icon_carapace,7,0
1045,Fertile Mud,6,99,6000,600,Mud that Barroth roll around in. Nutrient-rich and great for farming.,icon_dung,7,0
1046,Hyper Barroth Cortex,8,99,42100,4210,"Darker than normal Barroth shell, this tough Hyper shell emits an ominous glow.",icon_shell,7,0
1047,Uragaan Scale,4,99,5500,550,A hardened scale composed of ore that gives off a faint glow when exposed to light.,icon_scale,4,0
1048,Uragaan Scale+,6,99,16500,1650,A strong scale formed by layers and layers of ore. Its hardness makes forging tricky.,icon_scale,4,0
1049,Uragaan Shard,8,99,49500,4950,An impenetrable scale found on certain Uragaan. Formed when layers of hard ore bonded.,icon_scale,4,0
1050,Uragaan Shell,4,99,9000,900,"This strong, sturdy piece of exoskeleton makes armor that looks dull but works great.",icon_shell,4,0
1051,Uragaan Carapace,6,99,27000,2700,A hard Uragaan carapace. Its rigidity makes it quite a challenge to remove.,icon_shell,4,0
1052,Uragaan Cortex,8,99,66900,6690,"An especially hard Uragaan cortex. Crafting with it can be a trying task, to say the least.",icon_shell,4,0
1053,Uragaan Jaw,4,99,12600,1260,A crooked Uragaan jaw. Coated with melted minerals that have hardened over time.,icon_carapace,4,0
1054,Uragaan Jaw+,8,99,75600,7560,An exceptionally heavy Uragaan jaw. Its destructive power comes from a makeup of dense ore.,icon_carapace,4,0
1055,Uragaan Scute,4,99,14500,1450,"Even more heat resistant than the Shell, this is said to protect sensitive organs.",icon_carapace,4,0
1056,Uragaan Scute+,8,99,87000,8700,A highly heat-resistant Uragaan scute. Its thermal insulation promises new armor possibilities.,icon_carapace,4,0
1057,Uragaan Marrow,5,99,18000,1800,Hard-to-obtain bone marrow used for special crafts as well as medicinal purposes.,icon_carapace,4,0
1058,Uragaan Ruby,7,99,75000,7500,A precious Uragaan gem. Prized for its strengthening ability during the forging process.,icon_monster_jewel,4,0
1059,Uragaan Pallium,9,99,127500,12750,A legendary Uragaan shell. Those who craft it rule the earth and seize the sky.,icon_mantle,4,0
1060,Hyper Uragaan Scale,6,99,19800,1980,"Darker than normal Uragaan scales, this Hyper scale emits an ominous glow.",icon_scale,4,0
1061,Hyper Uragaan Shard,8,99,59400,5940,"Darker than normal Uragaan scales, this tough Hyper scale emits an ominous glow.",icon_scale,4,0
1062,Crystalbeard Scale,6,99,7700,770,A Crystalbeard Uragaan scale. Contains unique ores that make it shine bright.,icon_scale,11,0
1063,Crystalbeard Scale+,7,99,23100,2310,A high-quality Crystalbeard Uragaan scale. Contains unique ores that make it shine bright.,icon_scale,11,0
1064,Crystalbeard Shard,9,99,69300,6930,An exquisite Crystalbeard Uragaan scale. Has exceptional shock-absorbing ability.,icon_scale,11,0
1065,Crystalbeard Jaw,6,99,17600,1760,The jaw from a Crystalbeard Uragaan. Contains unique ores that make it shine bright.,icon_carapace,5,0
1066,Crystalbeard Maw,7,99,52800,5280,A high-quality Crystalbeard Uragaan jaw. Contains unique ores that make it shine bright.,icon_carapace,5,0
1067,Crystalbeard Mandible,9,99,105600,10560,An exceptional Crystalbeard Uragaan jaw. Contains so much ore that it is dazzlingly bright.,icon_carapace,5,0
1068,Treasure Nugget,7,99,100000,10000,A stone shard taken from a Crystalbeard Uragaan. Prized for the rare minerals within it.,icon_ore,5,0
1069,Large Treasure Nugget,9,99,200000,20000,A large stone shard taken from a Crystalbeard Uragaan. Prized for the rare minerals within it.,icon_ore,5,0
1070,Brach Shell,4,99,10000,1000,"A dark green Brachydios shell. Glossy like obsidian, it adds a refined beauty to crafted gear.",icon_shell,3,0
1071,Brach Carapace,6,99,15000,1500,"A hard Brachydios carapace. Glossy like obsidian, it adds a refined beauty to crafted gear.",icon_shell,3,0
1072,Brach Cortex,8,99,45000,4500,Thick cortex of a Brachydios. Its stoic beauty adds strength and dignity to equipment.,icon_shell,3,0
1073,Brach Ebonshell,4,99,9800,980,"An obsidian Brachydios brace. Makes especially strong armor, perhaps due to the slime mold.",icon_carapace,3,0
1074,Brach Ebonshell+,6,99,19000,1900,An obsidian shell from the foreleg. It has evolved to withstand slime blasts.,icon_carapace,3,0
1075,Fine Brach Ebonshell,8,99,57000,5700,"A premium Brachydios brace. The slime coating may contain weird bacteria, so be careful.",icon_carapace,3,0
1076,Brach Scalp,4,99,11800,1180,"The large, protruding scalp of a Brachydios, covered in an explosive green substance.",icon_carapace,3,0
1077,Brach Scalp+,6,99,24300,2430,A hard and sharp scalp piece from a fierce Brachydios. Even more explosive than usual.,icon_carapace,3,0
1078,Brach Crown,8,99,72900,7290,A large head projection that continually produces potent slime from within.,icon_carapace,3,0
1079,Brach Warhead,8,99,94700,9470,A skull that rage has turned into something far worse. The pinnacle of materials.,icon_carapace,3,0
1080,Mystery Slime,4,99,12300,1230,The explosive green substance found on Brachydios monsters. Handle with extreme care.,icon_liquid,9,0
1081,Glowing Slime,8,99,36900,3690,A highly volatile fluid used by especially savage Brachydios. Handle very carefully!,icon_liquid,9,0
1082,Flashpoint Slime,8,99,47900,4790,Red Brachydios slime at its most volatile: right before an all-or-nothing attack.,icon_liquid,1,0
1083,Brach Hammer,4,99,12800,1280,An arm that has crushed the courage out of many a hunter. Slime makes forging tricky.,icon_carapace,3,0
1084,Brach Pounder,6,99,27400,2740,A Brachydios arm that buried countless foolhardy hunters. It's covered in green slime.,icon_carapace,3,0
1085,Brach Pounder+,8,99,82200,8220,"The arm of an especially angry Brachydios. Strong and heavy, as if made of iron.",icon_carapace,3,0
1086,Brach Obliterator,8,99,106800,10680,A violent mass that triggers blasts well beyond anything a Barrel Bomb L can do.,icon_carapace,3,0
1087,Brach Tail,4,99,15000,1500,"While most focus on Brachydios's arms, its tail is also strong. Beware the explosive slime!",icon_carapace,3,0
1088,Brach Lash,8,99,90000,9000,A strong tail that hits like a cudgel and smashes through boulders like so much dust.,icon_carapace,3,0
1089,Brach Marrow,5,99,21000,2100,"Stickier than normal marrow. A top-class welding material, if you're in the market.",icon_carapace,3,0
1090,Brach Gem,7,99,93000,9300,A rare gem from a Brachydios. Perhaps the secret of its dreadful slime is hidden inside?,icon_monster_jewel,3,0
1091,Brach Pallium,9,99,144000,14400,A legendary Brachydios shell. Those who craft it rule the earth and seize the sky.,icon_mantle,3,0
1092,Immortal Reactor,9,99,187200,18720,A hard-to-obtain Brachydios organ. Used to render slime more volatile when in peril.,icon_mantle,3,0
1093,Hyper Brach Shell,6,99,18000,1800,"Darker than normal Brachydios shell, this Hyper shell emits an ominous glow.",icon_shell,3,0
1094,Hyper Brach Cortex,8,99,54000,5400,"Darker than normal Brachydios shell, this tough Hyper shell emits an ominous glow.",icon_shell,3,0
1095,Duram Carapace,6,99,24900,2490,A stiff Duramboros carapace. It can withstand attacks like an impenetrable aegis.,icon_shell,2,0
1096,Duramboros Cortex,8,99,74700,7470,"A Duramboros cortex. This heavy, strong armor saps an opponent's will to fight.",icon_shell,2,0
1097,Hard Mossplate,6,99,26400,2640,"A shell covered in moss. Not only is it hard, the moss absorbs the shock of physical blows.",icon_hide,2,0
1098,Heavy Mossplate,8,99,79200,7920,A Duramboros cortex covered in moss. Its weight and mossy shock absorber make it impenetrable.,icon_hide,2,0
